<?xml version="1.0"?>
<!DOCTYPE futbol SYSTEM "futbol.dtd">

<futbol>
<vacio/>
<noVacio>Dato</noVacio>
    <equipos>
        <equipo>
            <nombre>Betis</nombre>
            <copas>0</copas>
            <jugadores>
                <pichichi>
                    <nombreP>Joaquin</nombreP>
                    <fechaNacimiento>1980-10-10</fechaNacimiento>
                    <goles>100</goles>
                    <tarjetas>
                        <amarillas>1</amarillas>
                        <rojas>0</rojas>
                    </tarjetas>
                </pichichi>
            </jugadores>
            <equipacion>
                <primera>blanco y verde</primera>
                <segunda>azul y blanca</segunda>
            </equipacion>
            <partidos>
                <jugados>
                    <ganados>100</ganados>
                    <perdidos>10</perdidos>
                    <empatados>50</empatados>
                </jugados>
            </partidos>
            <estadio> 
                <nombreE>Benito Villamar√≠n</nombreE>
                <capacidad>60000</capacidad>
            </estadio>
        </equipo>
    </equipos>

</futbol>